562130,23053,RECYCLED ACAPULCO MAT PINK,2,2011-08-03,8.25,12750,Poland
562130,22622,BOX OF VINTAGE ALPHABET BLOCKS,2,2011-08-03,11.95,12750,Poland
562130,23240,SET OF 4 KNICK KNACK TINS DOILEY,6,2011-08-03,4.15,12750,Poland
562130,23238,SET OF 4 KNICK KNACK TINS LONDON,6,2011-08-03,4.15,12750,Poland
562130,22898,CHILDRENS APRON APPLES DESIGN,8,2011-08-03,1.95,12750,Poland
562130,22726,ALARM CLOCK BAKELIKE GREEN,4,2011-08-03,3.75,12750,Poland
562130,16161U,WRAP SUKI AND FRIENDS,25,2011-08-03,0.42,12750,Poland
562130,23231,WRAP DOILEY DESIGN,25,2011-08-03,0.42,12750,Poland
562130,22710,WRAP I LOVE LONDON,25,2011-08-03,0.42,12750,Poland
562131,23289,DOLLY GIRL CHILDRENS BOWL,8,2011-08-03,1.25,18178,United Kingdom
562131,23290,SPACEBOY CHILDRENS BOWL,8,2011-08-03,1.25,18178,United Kingdom
562131,85099B,JUMBO BAG RED RETROSPOT,10,2011-08-03,2.08,18178,United Kingdom
562131,22197,POPCORN HOLDER,12,2011-08-03,0.85,18178,United Kingdom
562131,22662,LUNCH BAG DOLLY GIRL DESIGN,10,2011-08-03,1.65,18178,United Kingdom
562131,23108,SET OF 10 LED DOLLY LIGHTS,2,2011-08-03,6.25,18178,United Kingdom
562131,20970,PINK FLORAL FELTCRAFT SHOULDER BAG,4,2011-08-03,3.75,18178,United Kingdom
562131,22750,FELTCRAFT PRINCESS LOLA DOLL,4,2011-08-03,3.75,18178,United Kingdom
562131,22749,FELTCRAFT PRINCESS CHARLOTTE DOLL,4,2011-08-03,3.75,18178,United Kingdom
562131,22568,FELTCRAFT CUSHION OWL,4,2011-08-03,3.75,18178,United Kingdom
562131,23301,GARDENERS KNEELING PAD KEEP CALM,12,2011-08-03,1.65,18178,United Kingdom
562131,22382,LUNCH BAG SPACEBOY DESIGN,10,2011-08-03,1.65,18178,United Kingdom
562131,22385,JUMBO BAG SPACEBOY DESIGN,10,2011-08-03,2.08,18178,United Kingdom
562131,22614,PACK OF 12 SPACEBOY TISSUES,48,2011-08-03,0.29,18178,United Kingdom
562131,71477,COLOUR GLASS. STAR T-LIGHT HOLDER,8,2011-08-03,3.25,18178,United Kingdom
562131,84755,COLOUR GLASS T-LIGHT HOLDER HANGING,16,2011-08-03,0.65,18178,United Kingdom
562131,71053,WHITE METAL LANTERN,8,2011-08-03,3.75,18178,United Kingdom
562131,22784,LANTERN CREAM GAZEBO,3,2011-08-03,4.95,18178,United Kingdom
562131,21033,JUMBO BAG CHARLIE AND LOLA TOYS,10,2011-08-03,2.08,18178,United Kingdom
562131,23201,JUMBO BAG ALPHABET,10,2011-08-03,2.08,18178,United Kingdom
562131,22745,POPPY'S PLAYHOUSE BEDROOM,6,2011-08-03,2.1,18178,United Kingdom
562131,22746,POPPY'S PLAYHOUSE LIVINGROOM,6,2011-08-03,2.1,18178,United Kingdom
562131,22747,POPPY'S PLAYHOUSE BATHROOM,6,2011-08-03,2.1,18178,United Kingdom
562131,22383,LUNCH BAG SUKI DESIGN,20,2011-08-03,1.65,18178,United Kingdom
562131,20728,LUNCH BAG CARS BLUE,10,2011-08-03,1.65,18178,United Kingdom
562131,23300,GARDENERS KNEELING PAD CUP OF TEA,12,2011-08-03,1.65,18178,United Kingdom
562131,23199,JUMBO BAG APPLES,10,2011-08-03,2.08,18178,United Kingdom
562131,20725,LUNCH BAG RED RETROSPOT,10,2011-08-03,1.65,18178,United Kingdom
562131,22748,POPPY'S PLAYHOUSE KITCHEN,6,2011-08-03,2.1,18178,United Kingdom
562132,22492,MINI PAINT SET VINTAGE,36,2011-08-03,0.65,13384,United Kingdom
562132,23192,BUNDLE OF 3 ALPHABET EXERCISE BOOKS,12,2011-08-03,1.65,13384,United Kingdom
562132,21509,COWBOYS AND INDIANS BIRTHDAY CARD,24,2011-08-03,0.42,13384,United Kingdom
562132,23201,JUMBO BAG ALPHABET,20,2011-08-03,2.08,13384,United Kingdom
562132,23207,LUNCH BAG ALPHABET DESIGN,40,2011-08-03,1.65,13384,United Kingdom
562132,23208,LUNCH BAG VINTAGE LEAF DESIGN,20,2011-08-03,1.65,13384,United Kingdom
562132,20728,LUNCH BAG CARS BLUE,20,2011-08-03,1.65,13384,United Kingdom
562132,22082,RIBBON REEL STRIPES DESIGN,10,2011-08-03,1.65,13384,United Kingdom
562132,22080,RIBBON REEL POLKADOTS,10,2011-08-03,1.65,13384,United Kingdom
562132,22079,RIBBON REEL HEARTS DESIGN,10,2011-08-03,1.65,13384,United Kingdom
562132,22350,ILLUSTRATED CAT BOWL,6,2011-08-03,2.55,13384,United Kingdom
562132,23296,SET OF 6 TEA TIME BAKING CASES,12,2011-08-03,1.25,13384,United Kingdom
562132,23294,SET OF 6 SNACK LOAF BAKING CASES,12,2011-08-03,0.83,13384,United Kingdom
562132,23199,JUMBO BAG APPLES,20,2011-08-03,2.08,13384,United Kingdom
562132,23206,LUNCH BAG APPLE DESIGN,60,2011-08-03,1.65,13384,United Kingdom
562132,22908,PACK OF 20 NAPKINS RED APPLES,12,2011-08-03,0.85,13384,United Kingdom
562132,22896,PEG BAG APPLES DESIGN,12,2011-08-03,2.55,13384,United Kingdom
562132,82582,AREA PATROLLED METAL SIGN,12,2011-08-03,2.1,13384,United Kingdom
562132,21124,SET/10 BLUE POLKADOT PARTY CANDLES,24,2011-08-03,1.25,13384,United Kingdom
562132,21122,SET/10 PINK POLKADOT PARTY CANDLES,24,2011-08-03,1.25,13384,United Kingdom
562133,84879,ASSORTED COLOUR BIRD ORNAMENT,2,2011-08-03,1.69,16419,United Kingdom
562133,40001,WHITE BAMBOO RIBS LAMPSHADE,24,2011-08-03,0.85,16419,United Kingdom
562133,22178,VICTORIAN GLASS HANGING T-LIGHT,6,2011-08-03,1.25,16419,United Kingdom
562133,84947,ANTIQUE SILVER TEA GLASS ENGRAVED,24,2011-08-03,1.25,16419,United Kingdom
562133,79051A,SMOKEY GREY COLOUR D.O.F. GLASS,12,2011-08-03,0.29,16419,United Kingdom
562133,23091,ZINC HERB GARDEN CONTAINER,2,2011-08-03,6.25,16419,United Kingdom
562133,23315,IVORY REFECTORY CLOCK,1,2011-08-03,9.95,16419,United Kingdom
562133,23123,COCKTAIL SWORDS 50 PIECES,1,2011-08-03,0.83,16419,United Kingdom
562133,21207,SKULL AND CROSSBONES  GARLAND,2,2011-08-03,1.65,16419,United Kingdom
562133,23018,LARGE APOTHECARY MEASURING JAR,1,2011-08-03,12.5,16419,United Kingdom
562133,23019,SMALL APOTHECARY MEASURING JAR,1,2011-08-03,8.25,16419,United Kingdom
562134,22722,unknown,1,2011-08-03,0.0,,United Kingdom
562135,84847,unknown,1,2011-08-03,0.0,,United Kingdom
562136,21684,SMALL MEDINA STAMPED METAL BOWL,108,2011-08-03,0.85,15374,United Kingdom
562136,82600,NO SINGING METAL SIGN,12,2011-08-03,2.1,15374,United Kingdom
562136,22752,SET 7 BABUSHKA NESTING BOXES,6,2011-08-03,8.5,15374,United Kingdom
562137,23293,SET OF 12 FAIRY CAKE BAKING CASES,16,2011-08-03,0.83,12720,Germany
562137,23296,SET OF 6 TEA TIME BAKING CASES,16,2011-08-03,1.25,12720,Germany
562137,23309,SET OF 60 I LOVE LONDON CAKE CASES,24,2011-08-03,0.55,12720,Germany
562137,23295,SET OF 12 MINI LOAF BAKING CASES,16,2011-08-03,0.83,12720,Germany
562137,23297,SET 40 HEART SHAPE PETIT FOUR CASES,16,2011-08-03,1.65,12720,Germany
562137,23294,SET OF 6 SNACK LOAF BAKING CASES,16,2011-08-03,0.83,12720,Germany
562137,23545,WRAP RED DOILEY,25,2011-08-03,0.42,12720,Germany
562137,22326,ROUND SNACK BOXES SET OF4 WOODLAND,6,2011-08-03,2.95,12720,Germany
562137,23203,JUMBO BAG DOILEY PATTERNS,10,2011-08-03,2.08,12720,Germany
562137,85099F,JUMBO BAG STRAWBERRY,10,2011-08-03,2.08,12720,Germany
562137,21929,JUMBO BAG PINK VINTAGE PAISLEY,10,2011-08-03,2.08,12720,Germany
562137,85227,SET OF 6 3D KIT CARDS FOR KIDS,12,2011-08-03,0.85,12720,Germany
562137,22386,JUMBO BAG PINK POLKADOT,10,2011-08-03,2.08,12720,Germany
562138,21621,VINTAGE UNION JACK BUNTING,20,2011-08-03,8.5,14737,United Kingdom
562138,22734,SET OF 6 RIBBONS VINTAGE CHRISTMAS,30,2011-08-03,2.89,14737,United Kingdom
562138,21533,RETROSPOT LARGE MILK JUG,12,2011-08-03,4.25,14737,United Kingdom
562138,22086,PAPER CHAIN KIT 50'S CHRISTMAS,40,2011-08-03,2.55,14737,United Kingdom
562138,22427,ENAMEL FLOWER JUG CREAM,24,2011-08-03,5.45,14737,United Kingdom
562138,21534,DAIRY MAID LARGE MILK JUG,12,2011-08-03,4.25,14737,United Kingdom
562138,21467,CHERRY CROCHET FOOD COVER,15,2011-08-03,3.75,14737,United Kingdom
C562139,84978,HANGING HEART JAR T-LIGHT HOLDER,-1,2011-08-03,1.25,12921,United Kingdom
C562139,22456,NATURAL SLATE CHALKBOARD LARGE,-2,2011-08-03,4.95,12921,United Kingdom
C562139,21313,GLASS HEART T-LIGHT HOLDER,-4,2011-08-03,0.85,12921,United Kingdom
562140,22180,RETROSPOT LAMP,3,2011-08-03,9.95,18241,United Kingdom
562140,21878,PACK OF 6 SANDCASTLE FLAGS ASSORTED,12,2011-08-03,0.85,18241,United Kingdom
562140,21718,RED METAL BEACH SPADE,12,2011-08-03,1.25,18241,United Kingdom
562140,21716,BOYS VINTAGE TIN SEASIDE BUCKET,8,2011-08-03,2.55,18241,United Kingdom
562140,21715,GIRLS VINTAGE TIN SEASIDE BUCKET,8,2011-08-03,2.55,18241,United Kingdom
562141,22606,WOODEN SKITTLES GARDEN SET,6,2011-08-03,12.75,17389,United Kingdom
562141,22766,PHOTO FRAME CORNICE,12,2011-08-03,2.95,17389,United Kingdom
562141,21380,WOODEN HAPPY BIRTHDAY GARLAND,12,2011-08-03,2.95,17389,United Kingdom
562141,22605,WOODEN CROQUET GARDEN SET,12,2011-08-03,12.75,17389,United Kingdom
562141,85066,CREAM SWEETHEART MINI CHEST,12,2011-08-03,10.95,17389,United Kingdom
562141,84970L,SINGLE HEART ZINC T-LIGHT HOLDER,12,2011-08-03,0.79,17389,United Kingdom
C562142,23163,REGENCY SUGAR TONGS,-7,2011-08-03,2.08,15189,United Kingdom
562143,21889,WOODEN BOX OF DOMINOES,24,2011-08-03,1.25,16422,United Kingdom
562143,22621,TRADITIONAL KNITTING NANCY,72,2011-08-03,1.45,16422,United Kingdom
562143,22492,MINI PAINT SET VINTAGE,72,2011-08-03,0.65,16422,United Kingdom
562143,21643,ASSORTED TUTTI FRUTTI MIRROR,72,2011-08-03,1.25,16422,United Kingdom
562143,20972,PINK CREAM FELT CRAFT TRINKET BOX,36,2011-08-03,1.25,16422,United Kingdom
562143,21790,VINTAGE SNAP CARDS,24,2011-08-03,0.85,16422,United Kingdom
562143,21832,CHOCOLATE CALCULATOR,24,2011-08-03,1.65,16422,United Kingdom
562143,22629,SPACEBOY LUNCH BOX,12,2011-08-03,1.95,16422,United Kingdom
562143,22630,DOLLY GIRL LUNCH BOX,12,2011-08-03,1.95,16422,United Kingdom
562143,23077,DOUGHNUT LIP GLOSS,200,2011-08-03,1.04,16422,United Kingdom
562143,22759,SET OF 3 NOTEBOOKS IN PARCEL,96,2011-08-03,1.45,16422,United Kingdom
562143,21210,SET OF 72 RETROSPOT PAPER  DOILIES,96,2011-08-03,1.25,16422,United Kingdom
562143,21380,WOODEN HAPPY BIRTHDAY GARLAND,12,2011-08-03,2.95,16422,United Kingdom
562143,22090,PAPER BUNTING RETROSPOT,80,2011-08-03,2.55,16422,United Kingdom
562143,47590B,PINK HAPPY BIRTHDAY BUNTING,50,2011-08-03,4.65,16422,United Kingdom
562143,47590A,BLUE HAPPY BIRTHDAY BUNTING,50,2011-08-03,4.65,16422,United Kingdom
562143,21326,AGED GLASS SILVER T-LIGHT HOLDER,84,2011-08-03,0.65,16422,United Kingdom
562143,23122,PARTY CHARMS 50 PIECES,144,2011-08-03,0.72,16422,United Kingdom
562143,21821,GLITTER STAR GARLAND WITH BELLS,24,2011-08-03,3.75,16422,United Kingdom
562143,22121,NOEL WOODEN BLOCK LETTERS,12,2011-08-03,5.45,16422,United Kingdom
562143,22152,PLACE SETTING WHITE STAR,48,2011-08-03,0.42,16422,United Kingdom
562143,22940,FELTCRAFT CHRISTMAS FAIRY,48,2011-08-03,3.75,16422,United Kingdom
562143,21648,ASSORTED TUTTI FRUTTI SMALL PURSE,24,2011-08-03,1.25,16422,United Kingdom
562143,21833,CAMOUFLAGE LED TORCH,144,2011-08-03,1.49,16422,United Kingdom
C562144,21643,ASSORTED TUTTI FRUTTI MIRROR,-12,2011-08-03,1.25,12757,Portugal
562145,48194,DOORMAT HEARTS,2,2011-08-03,7.95,17656,United Kingdom
562145,22595,GINGHAM HEART DECORATION,12,2011-08-03,0.85,17656,United Kingdom
562145,23110,PARISIENNE KEY CABINET,4,2011-08-03,5.75,17656,United Kingdom
562145,82486,WOOD S/3 CABINET ANT WHITE FINISH,2,2011-08-03,8.95,17656,United Kingdom
562145,22690,DOORMAT HOME SWEET HOME BLUE,2,2011-08-03,7.95,17656,United Kingdom
562145,21115,ROSE CARAVAN DOORSTOP,4,2011-08-03,6.75,17656,United Kingdom
562145,22508,DOORSTOP RETROSPOT HEART,4,2011-08-03,3.75,17656,United Kingdom
562145,82484,WOOD BLACK BOARD ANT WHITE FINISH,2,2011-08-03,7.95,17656,United Kingdom
562145,82494L,WOODEN FRAME ANTIQUE WHITE,6,2011-08-03,2.95,17656,United Kingdom
562145,22771,CLEAR DRAWER KNOB ACRYLIC EDWARDIAN,12,2011-08-03,1.25,17656,United Kingdom
562145,22342,HOME GARLAND PAINTED ZINC,24,2011-08-03,0.75,17656,United Kingdom
562145,22670,FRENCH WC SIGN BLUE METAL,12,2011-08-03,1.25,17656,United Kingdom
562145,85152,HAND OVER THE CHOCOLATE   SIGN,12,2011-08-03,2.1,17656,United Kingdom
562145,21907,I'M ON HOLIDAY METAL SIGN,12,2011-08-03,2.1,17656,United Kingdom
562145,23227,FILIGREE HEART BUTTERFLY WHITE,24,2011-08-03,1.25,17656,United Kingdom
562145,21209,MULTICOLOUR HONEYCOMB FAN,12,2011-08-03,0.39,17656,United Kingdom
562145,23094,LE GRAND TRAY CHIC SET,2,2011-08-03,12.5,17656,United Kingdom
562145,23108,SET OF 10 LED DOLLY LIGHTS,4,2011-08-03,6.25,17656,United Kingdom
562146,23286,BLUE VINTAGE SPOT BEAKER,8,2011-08-03,0.85,17675,United Kingdom
562146,23288,GREEN VINTAGE SPOT BEAKER,8,2011-08-03,0.85,17675,United Kingdom
562146,23243,SET OF TEA COFFEE SUGAR TINS PANTRY,8,2011-08-03,4.95,17675,United Kingdom
562146,22139,RETROSPOT TEA SET CERAMIC 11 PC,3,2011-08-03,4.95,17675,United Kingdom
562146,21933,PINK VINTAGE PAISLEY PICNIC BAG,10,2011-08-03,1.65,17675,United Kingdom
562146,21932,SCANDINAVIAN PAISLEY PICNIC BAG,10,2011-08-03,1.65,17675,United Kingdom
562146,20726,LUNCH BAG WOODLAND,10,2011-08-03,1.65,17675,United Kingdom
562146,22382,LUNCH BAG SPACEBOY DESIGN,10,2011-08-03,1.65,17675,United Kingdom
562146,22383,LUNCH BAG SUKI DESIGN,10,2011-08-03,1.65,17675,United Kingdom
562146,23209,LUNCH BAG DOILEY PATTERN,10,2011-08-03,1.65,17675,United Kingdom
562146,23208,LUNCH BAG VINTAGE LEAF DESIGN,10,2011-08-03,1.65,17675,United Kingdom
562146,23206,LUNCH BAG APPLE DESIGN,10,2011-08-03,1.65,17675,United Kingdom
562146,21465,PINK FLOWER CROCHET FOOD COVER,6,2011-08-03,3.75,17675,United Kingdom
562146,21466,RED FLOWER CROCHET FOOD COVER,6,2011-08-03,3.75,17675,United Kingdom
562146,82484,WOOD BLACK BOARD ANT WHITE FINISH,4,2011-08-03,7.95,17675,United Kingdom
562146,84879,ASSORTED COLOUR BIRD ORNAMENT,32,2011-08-03,1.69,17675,United Kingdom
562146,20979,36 PENCILS TUBE RED RETROSPOT,16,2011-08-03,1.25,17675,United Kingdom
562146,20978,36 PENCILS TUBE SKULLS,16,2011-08-03,1.25,17675,United Kingdom
562146,22720,SET OF 3 CAKE TINS PANTRY DESIGN,3,2011-08-03,4.95,17675,United Kingdom
562146,20713,JUMBO BAG OWLS,10,2011-08-03,2.08,17675,United Kingdom
562146,21929,JUMBO BAG PINK VINTAGE PAISLEY,10,2011-08-03,2.08,17675,United Kingdom
562146,20712,JUMBO BAG WOODLAND ANIMALS,10,2011-08-03,2.08,17675,United Kingdom
562146,22411,JUMBO SHOPPER VINTAGE RED PAISLEY,10,2011-08-03,2.08,17675,United Kingdom
562146,23200,JUMBO BAG PEARS,10,2011-08-03,2.08,17675,United Kingdom
562146,23203,JUMBO BAG DOILEY PATTERNS,10,2011-08-03,2.08,17675,United Kingdom
562146,85099C,JUMBO  BAG BAROQUE BLACK WHITE,10,2011-08-03,2.08,17675,United Kingdom
562146,21922,UNION STRIPE WITH FRINGE  HAMMOCK,12,2011-08-03,6.95,17675,United Kingdom
C562147,22649,STRAWBERRY FAIRY CAKE TEAPOT,-1,2011-08-03,4.95,16180,United Kingdom
C562147,22699,ROSES REGENCY TEACUP AND SAUCER,-1,2011-08-03,2.95,16180,United Kingdom
C562147,22064,PINK DOUGHNUT TRINKET POT,-1,2011-08-03,1.65,16180,United Kingdom
C562147,23206,LUNCH BAG APPLE DESIGN,-1,2011-08-03,1.65,16180,United Kingdom
C562147,21232,STRAWBERRY CERAMIC TRINKET BOX,-1,2011-08-03,1.25,16180,United Kingdom
C562147,22328,ROUND SNACK BOXES SET OF 4 FRUITS,-1,2011-08-03,2.95,16180,United Kingdom
C562147,22697,GREEN REGENCY TEACUP AND SAUCER,-1,2011-08-03,2.95,16180,United Kingdom
562148,22669,RED BABY BUNTING,5,2011-08-03,2.95,13695,United Kingdom
562148,21198,WHITE HEART CONFETTI IN TUBE,12,2011-08-03,1.65,13695,United Kingdom
562148,22791,T-LIGHT GLASS FLUTED ANTIQUE,72,2011-08-03,1.06,13695,United Kingdom
562148,22961,JAM MAKING SET PRINTED,12,2011-08-03,1.45,13695,United Kingdom
562148,22960,JAM MAKING SET WITH JARS,12,2011-08-03,3.75,13695,United Kingdom
562148,22178,VICTORIAN GLASS HANGING T-LIGHT,24,2011-08-03,1.25,13695,United Kingdom
562148,23444,Next Day Carriage,1,2011-08-03,15.0,13695,United Kingdom
562150,22273,FELTCRAFT DOLL MOLLY,6,2011-08-03,2.95,14132,United Kingdom
562150,22271,FELTCRAFT DOLL ROSIE,12,2011-08-03,2.95,14132,United Kingdom
562150,22586,FELTCRAFT HAIRBAND PINK AND BLUE,12,2011-08-03,0.85,14132,United Kingdom
562150,22209,WOOD STAMP SET HAPPY BIRTHDAY,12,2011-08-03,0.83,14132,United Kingdom
562150,23191,BUNDLE OF 3 RETRO NOTE BOOKS,12,2011-08-03,1.65,14132,United Kingdom
562150,22150,3 STRIPEY MICE FELTCRAFT,12,2011-08-03,1.95,14132,United Kingdom
562150,22149,FELTCRAFT 6 FLOWER FRIENDS,6,2011-08-03,2.1,14132,United Kingdom
562150,22565,FELTCRAFT HAIRBANDS PINK AND WHITE,12,2011-08-03,0.85,14132,United Kingdom
562150,22566,FELTCRAFT HAIRBAND PINK AND PURPLE,12,2011-08-03,0.85,14132,United Kingdom
562150,22493,PAINT YOUR OWN CANVAS SET,36,2011-08-03,1.65,14132,United Kingdom
562150,22208,WOOD STAMP SET THANK YOU,12,2011-08-03,0.83,14132,United Kingdom
562150,22274,FELTCRAFT DOLL EMILY,12,2011-08-03,2.95,14132,United Kingdom
562150,22750,FELTCRAFT PRINCESS LOLA DOLL,8,2011-08-03,3.75,14132,United Kingdom
562150,85185B,PINK HORSE SOCK PUPPET,6,2011-08-03,2.95,14132,United Kingdom
C562149,23205,CHARLOTTE BAG VINTAGE ALPHABET,-1,2011-08-03,0.85,13534,United Kingdom
C562149,23204,CHARLOTTE BAG APPLES DESIGN,-1,2011-08-03,0.85,13534,United Kingdom
C562149,23203,JUMBO BAG DOILEY PATTERNS,-1,2011-08-03,2.08,13534,United Kingdom
C562149,21930,JUMBO STORAGE BAG SKULLS,-1,2011-08-03,2.08,13534,United Kingdom
C562149,20711,JUMBO BAG TOYS,-1,2011-08-03,2.08,13534,United Kingdom
C562151,22637,PIGGY BANK RETROSPOT,-1,2011-08-03,2.1,17053,United Kingdom
562152,21188,3D HEARTS  HONEYCOMB PAPER GARLAND,24,2011-08-03,2.55,16168,United Kingdom
562152,21733,RED HANGING HEART T-LIGHT HOLDER,6,2011-08-03,2.95,16168,United Kingdom
562152,84755,COLOUR GLASS T-LIGHT HOLDER HANGING,32,2011-08-03,0.65,16168,United Kingdom
562152,85123A,WHITE HANGING HEART T-LIGHT HOLDER,32,2011-08-03,2.55,16168,United Kingdom
562152,22927,GREEN GIANT GARDEN THERMOMETER,2,2011-08-03,5.95,16168,United Kingdom
562152,22928,YELLOW GIANT GARDEN THERMOMETER,2,2011-08-03,5.95,16168,United Kingdom
562153,23192,BUNDLE OF 3 ALPHABET EXERCISE BOOKS,48,2011-08-03,1.45,14088,United Kingdom
562153,23191,BUNDLE OF 3 RETRO NOTE BOOKS,48,2011-08-03,1.45,14088,United Kingdom
562153,23190,BUNDLE OF 3 SCHOOL EXERCISE BOOKS,12,2011-08-03,1.45,14088,United Kingdom
562153,22759,SET OF 3 NOTEBOOKS IN PARCEL,48,2011-08-03,1.45,14088,United Kingdom
562153,22758,LARGE PURPLE BABUSHKA NOTEBOOK,48,2011-08-03,1.06,14088,United Kingdom
562153,22757,LARGE RED BABUSHKA NOTEBOOK,36,2011-08-03,1.06,14088,United Kingdom
562153,22756,LARGE YELLOW BABUSHKA NOTEBOOK,36,2011-08-03,1.06,14088,United Kingdom
562153,22662,LUNCH BAG DOLLY GIRL DESIGN,30,2011-08-03,1.45,14088,United Kingdom
562153,22659,LUNCH BOX I LOVE LONDON,24,2011-08-03,1.65,14088,United Kingdom
562153,22630,DOLLY GIRL LUNCH BOX,36,2011-08-03,1.65,14088,United Kingdom
562153,22629,SPACEBOY LUNCH BOX,24,2011-08-03,1.65,14088,United Kingdom
562153,22564,ALPHABET STENCIL CRAFT,24,2011-08-03,1.06,14088,United Kingdom
562153,22563,HAPPY STENCIL CRAFT,24,2011-08-03,1.06,14088,United Kingdom
562153,22562,MONSTERS STENCIL CRAFT,12,2011-08-03,1.06,14088,United Kingdom
562153,22561,WOODEN SCHOOL COLOURING SET,48,2011-08-03,1.45,14088,United Kingdom
562153,22491,PACK OF 12 COLOURED PENCILS,48,2011-08-03,0.72,14088,United Kingdom
562153,22382,LUNCH BAG SPACEBOY DESIGN,30,2011-08-03,1.45,14088,United Kingdom
562153,21561,DINOSAUR LUNCH BOX WITH CUTLERY,18,2011-08-03,2.1,14088,United Kingdom
562153,21559,STRAWBERRY LUNCH BOX WITH CUTLERY,42,2011-08-03,2.1,14088,United Kingdom
562153,21558,SKULL LUNCH BOX WITH CUTLERY,30,2011-08-03,2.1,14088,United Kingdom
562153,20983,12 PENCILS TALL TUBE RED RETROSPOT,48,2011-08-03,0.72,14088,United Kingdom
562153,20982,12 PENCILS TALL TUBE SKULLS,48,2011-08-03,0.72,14088,United Kingdom
C562154,23256,CHILDRENS CUTLERY SPACEBOY,-4,2011-08-03,4.15,13520,Switzerland
562155,22616,PACK OF 12 LONDON TISSUES,216,2011-08-03,0.25,17940,United Kingdom
562155,21986,PACK OF 12 PINK POLKADOT TISSUES,216,2011-08-03,0.25,17940,United Kingdom
562155,21985,PACK OF 12 HEARTS DESIGN TISSUES,216,2011-08-03,0.25,17940,United Kingdom
562156,23322,LARGE WHITE HEART OF WICKER,12,2011-08-03,2.95,14401,United Kingdom
562156,21158,MOODY GIRL DOOR HANGER,24,2011-08-03,0.39,14401,United Kingdom
562156,21159,MOODY BOY  DOOR HANGER,24,2011-08-03,0.39,14401,United Kingdom
562156,21382,SET/4 SPRING FLOWER DECORATION,60,2011-08-03,0.75,14401,United Kingdom
562156,85132C,CHARLIE AND LOLA FIGURES TINS,12,2011-08-03,1.95,14401,United Kingdom
562156,21165,BEWARE OF THE CAT METAL SIGN,48,2011-08-03,1.45,14401,United Kingdom
562156,21163,DO NOT TOUCH MY STUFF DOOR HANGER,24,2011-08-03,0.39,14401,United Kingdom
562156,72741,GRAND CHOCOLATECANDLE,18,2011-08-03,1.45,14401,United Kingdom
562156,85230B,CINNAMON SCENTED VOTIVE CANDLE,24,2011-08-03,0.29,14401,United Kingdom
562156,85230A,OPIUM SCENTED VOTIVE CANDLE,24,2011-08-03,0.29,14401,United Kingdom
562156,85230E,STRAWBRY SCENTED VOTIVE CANDLE,24,2011-08-03,0.29,14401,United Kingdom
562156,85230G,ORANGE VOTIVE CANDLE,24,2011-08-03,0.29,14401,United Kingdom
562156,37495,FAIRY CAKE BIRTHDAY CANDLE SET,4,2011-08-03,3.75,14401,United Kingdom
562156,23321,SMALL WHITE HEART OF WICKER,12,2011-08-03,1.65,14401,United Kingdom
562156,22469,HEART OF WICKER SMALL,12,2011-08-03,1.65,14401,United Kingdom
562157,22360,GLASS JAR ENGLISH CONFECTIONERY,8,2011-08-03,2.95,16012,United Kingdom
562157,22697,GREEN REGENCY TEACUP AND SAUCER,15,2011-08-03,2.95,16012,United Kingdom
562157,22698,PINK REGENCY TEACUP AND SAUCER,17,2011-08-03,2.95,16012,United Kingdom
562157,22699,ROSES REGENCY TEACUP AND SAUCER,17,2011-08-03,2.95,16012,United Kingdom
562157,22423,REGENCY CAKESTAND 3 TIER,10,2011-08-03,12.75,16012,United Kingdom
562157,23170,REGENCY TEA PLATE ROSES,14,2011-08-03,1.65,16012,United Kingdom
562157,23175,REGENCY MILK JUG PINK,10,2011-08-03,3.25,16012,United Kingdom
562157,23171,REGENCY TEA PLATE GREEN,12,2011-08-03,1.65,16012,United Kingdom
562157,23172,REGENCY TEA PLATE PINK,24,2011-08-03,1.65,16012,United Kingdom
562157,22697,GREEN REGENCY TEACUP AND SAUCER,2,2011-08-03,2.95,16012,United Kingdom
562157,23174,REGENCY SUGAR BOWL GREEN,12,2011-08-03,4.15,16012,United Kingdom
562157,23173,REGENCY TEAPOT ROSES,10,2011-08-03,9.95,16012,United Kingdom
562157,21654,RIDGED GLASS FINGER BOWL,6,2011-08-03,0.39,16012,United Kingdom
562157,21654,RIDGED GLASS FINGER BOWL,4,2011-08-03,0.39,16012,United Kingdom
562157,21974,SET OF 36 PAISLEY FLOWER DOILIES,2,2011-08-03,1.45,16012,United Kingdom
562157,23293,SET OF 12 FAIRY CAKE BAKING CASES,8,2011-08-03,0.83,16012,United Kingdom
562157,23297,SET 40 HEART SHAPE PETIT FOUR CASES,1,2011-08-03,1.65,16012,United Kingdom
562157,20984,12 PENCILS TALL TUBE POSY,6,2011-08-03,0.29,16012,United Kingdom
562157,20974,12 PENCILS SMALL TUBE SKULL,9,2011-08-03,0.65,16012,United Kingdom
562157,23161,REGENCY CAKE FORK,50,2011-08-03,1.25,16012,United Kingdom
562157,23160,REGENCY TEA SPOON,50,2011-08-03,1.25,16012,United Kingdom
562157,22606,WOODEN SKITTLES GARDEN SET,1,2011-08-03,15.95,16012,United Kingdom
562157,22030,SWALLOWS GREETING CARD,12,2011-08-03,0.42,16012,United Kingdom
562157,22707,WRAP MONSTER FUN,25,2011-08-03,0.42,16012,United Kingdom
562157,22334,DINOSAUR PARTY BAG + STICKER SET,2,2011-08-03,1.65,16012,United Kingdom
562157,22751,FELTCRAFT PRINCESS OLIVIA DOLL,1,2011-08-03,3.75,16012,United Kingdom
562157,22750,FELTCRAFT PRINCESS LOLA DOLL,2,2011-08-03,3.75,16012,United Kingdom
562157,22749,FELTCRAFT PRINCESS CHARLOTTE DOLL,2,2011-08-03,3.75,16012,United Kingdom
562158,20728,LUNCH BAG CARS BLUE,10,2011-08-03,1.65,15039,United Kingdom
562158,22437,SET OF 9 BLACK SKULL BALLOONS,10,2011-08-03,0.85,15039,United Kingdom
562158,20726,LUNCH BAG WOODLAND,10,2011-08-03,1.65,15039,United Kingdom
562158,23000,TRAVEL CARD WALLET TRANSPORT,1,2011-08-03,0.42,15039,United Kingdom
562158,22997,TRAVEL CARD WALLET UNION JACK,4,2011-08-03,0.42,15039,United Kingdom
562158,47566B,TEA TIME PARTY BUNTING,3,2011-08-03,4.95,15039,United Kingdom
562158,23209,LUNCH BAG DOILEY PATTERN,3,2011-08-03,1.65,15039,United Kingdom
562158,20725,LUNCH BAG RED RETROSPOT,4,2011-08-03,1.65,15039,United Kingdom
562158,22383,LUNCH BAG SUKI DESIGN,3,2011-08-03,1.65,15039,United Kingdom
562158,21621,VINTAGE UNION JACK BUNTING,1,2011-08-03,8.5,15039,United Kingdom
562158,21936,RED RETROSPOT PICNIC BAG,2,2011-08-03,2.95,15039,United Kingdom
562158,21172,PARTY METAL SIGN,1,2011-08-03,1.45,15039,United Kingdom
562158,22672,FRENCH BATHROOM SIGN BLUE METAL,1,2011-08-03,1.65,15039,United Kingdom
562158,21907,I'M ON HOLIDAY METAL SIGN,1,2011-08-03,2.1,15039,United Kingdom
562158,22413,METAL SIGN TAKE IT OR LEAVE IT,1,2011-08-03,2.95,15039,United Kingdom
562158,23053,RECYCLED ACAPULCO MAT PINK,1,2011-08-03,8.25,15039,United Kingdom
562158,23005,TRAVEL CARD WALLET I LOVE LONDON,1,2011-08-03,0.42,15039,United Kingdom
562158,23206,LUNCH BAG APPLE DESIGN,6,2011-08-03,1.65,15039,United Kingdom
562158,23298,SPOTTY BUNTING,3,2011-08-03,4.95,15039,United Kingdom
562158,22423,REGENCY CAKESTAND 3 TIER,2,2011-08-03,12.75,15039,United Kingdom
562158,23289,DOLLY GIRL CHILDRENS BOWL,1,2011-08-03,1.25,15039,United Kingdom
562158,23290,SPACEBOY CHILDRENS BOWL,1,2011-08-03,1.25,15039,United Kingdom
562158,21374,MIRRORED WALL ART SKULLS,1,2011-08-03,1.25,15039,United Kingdom
562158,23202,JUMBO BAG VINTAGE LEAF,10,2011-08-03,2.08,15039,United Kingdom
562158,47599B,BLUE PARTY BAGS,6,2011-08-03,2.1,15039,United Kingdom
562158,22067,CHOC TRUFFLE GOLD TRINKET POT,2,2011-08-03,1.65,15039,United Kingdom
562158,22649,STRAWBERRY FAIRY CAKE TEAPOT,1,2011-08-03,4.95,15039,United Kingdom
562158,21232,STRAWBERRY CERAMIC TRINKET BOX,1,2011-08-03,1.25,15039,United Kingdom
562158,22064,PINK DOUGHNUT TRINKET POT,2,2011-08-03,1.65,15039,United Kingdom
562158,47599A,PINK PARTY BAGS,7,2011-08-03,2.1,15039,United Kingdom
562158,20727,LUNCH BAG  BLACK SKULL.,10,2011-08-03,1.65,15039,United Kingdom
562158,85099F,JUMBO BAG STRAWBERRY,10,2011-08-03,2.08,15039,United Kingdom
562158,23203,JUMBO BAG DOILEY PATTERNS,10,2011-08-03,2.08,15039,United Kingdom
562158,21930,JUMBO STORAGE BAG SKULLS,10,2011-08-03,2.08,15039,United Kingdom
562158,22411,JUMBO SHOPPER VINTAGE RED PAISLEY,10,2011-08-03,2.08,15039,United Kingdom
562158,21523,DOORMAT FANCY FONT HOME SWEET HOME,1,2011-08-03,7.95,15039,United Kingdom
562158,21928,JUMBO BAG SCANDINAVIAN BLUE PAISLEY,10,2011-08-03,2.08,15039,United Kingdom
562158,22354,RETROSPOT PADDED SEAT CUSHION,6,2011-08-03,3.75,15039,United Kingdom
562158,22090,PAPER BUNTING RETROSPOT,12,2011-08-03,2.95,15039,United Kingdom
