562417,20717,STRAWBERRY SHOPPER BAG,1,2011-08-04,2.46,,United Kingdom
562417,22419,LIPSTICK PEN RED,15,2011-08-04,0.83,,United Kingdom
562417,22439,6 ROCKET BALLOONS,3,2011-08-04,1.25,,United Kingdom
562417,22460,EMBOSSED GLASS TEALIGHT HOLDER,11,2011-08-04,2.46,,United Kingdom
562417,22465,HANGING METAL STAR LANTERN,3,2011-08-04,3.29,,United Kingdom
562417,22467,GUMBALL COAT RACK,1,2011-08-04,4.96,,United Kingdom
562417,22469,HEART OF WICKER SMALL,20,2011-08-04,3.29,,United Kingdom
562417,22499,WOODEN UNION JACK BUNTING,2,2011-08-04,4.96,,United Kingdom
562417,22501,PICNIC BASKET WICKER LARGE,1,2011-08-04,20.79,,United Kingdom
562417,22508,DOORSTOP RETROSPOT HEART,1,2011-08-04,7.46,,United Kingdom
562417,22513,DOORSTOP FOOTBALL DESIGN,1,2011-08-04,7.46,,United Kingdom
562417,22595,GINGHAM HEART DECORATION,1,2011-08-04,1.63,,United Kingdom
562417,22607,WOODEN ROUNDERS GARDEN SET,2,2011-08-04,16.63,,United Kingdom
562417,22625,RED KITCHEN SCALES,1,2011-08-04,16.63,,United Kingdom
562417,22639,SET OF 4 NAPKIN CHARMS HEARTS,1,2011-08-04,4.96,,United Kingdom
562417,22675,FRENCH KITCHEN SIGN BLUE METAL,1,2011-08-04,2.46,,United Kingdom
562417,22689,DOORMAT MERRY CHRISTMAS RED,1,2011-08-04,16.63,,United Kingdom
562417,22699,ROSES REGENCY TEACUP AND SAUCER,4,2011-08-04,5.79,,United Kingdom
562417,22791,T-LIGHT GLASS FLUTED ANTIQUE,24,2011-08-04,2.46,,United Kingdom
562417,22872,NUMBER TILE COTTAGE GARDEN 4,1,2011-08-04,4.13,,United Kingdom
562417,22878,NUMBER TILE COTTAGE GARDEN No,1,2011-08-04,4.13,,United Kingdom
562417,22960,JAM MAKING SET WITH JARS,1,2011-08-04,8.29,,United Kingdom
562417,22963,JAM JAR WITH GREEN LID,2,2011-08-04,1.63,,United Kingdom
562417,22983,CARD BILLBOARD FONT,2,2011-08-04,0.83,,United Kingdom
562417,22989,SET 2 PANTRY DESIGN TEA TOWELS,1,2011-08-04,6.63,,United Kingdom
562417,23028,DRAWER KNOB CRACKLE GLAZE BLUE,1,2011-08-04,3.29,,United Kingdom
562417,23035,DRAWER KNOB CERAMIC IVORY,2,2011-08-04,3.29,,United Kingdom
562417,23051,RECYCLED ACAPULCO MAT BLUE,1,2011-08-04,16.63,,United Kingdom
562417,23053,RECYCLED ACAPULCO MAT PINK,1,2011-08-04,16.63,,United Kingdom
562417,23061,VINTAGE EMBOSSED HEART,10,2011-08-04,2.46,,United Kingdom
562417,23165,LARGE CERAMIC TOP STORAGE JAR,1,2011-08-04,3.29,,United Kingdom
562417,23173,REGENCY TEAPOT ROSES,1,2011-08-04,19.96,,United Kingdom
562417,23182,TOILET SIGN OCCUPIED OR VACANT,1,2011-08-04,2.46,,United Kingdom
562417,23199,JUMBO BAG APPLES,4,2011-08-04,4.13,,United Kingdom
562417,23201,JUMBO BAG ALPHABET,3,2011-08-04,4.13,,United Kingdom
562417,23205,CHARLOTTE BAG VINTAGE ALPHABET,15,2011-08-04,1.63,,United Kingdom
562417,23207,LUNCH BAG ALPHABET DESIGN,1,2011-08-04,4.13,,United Kingdom
562417,23225,CHERUB HEART DECORATION SILVER,1,2011-08-04,1.63,,United Kingdom
562417,23236,STORAGE TIN VINTAGE DOILEY,1,2011-08-04,5.79,,United Kingdom
562417,23249,VINTAGE RED ENAMEL TRIM PLATE,4,2011-08-04,3.29,,United Kingdom
562417,23250,VINTAGE RED TRIM ENAMEL BOWL,5,2011-08-04,2.46,,United Kingdom
562417,23251,VINTAGE RED ENAMEL TRIM MUG,9,2011-08-04,2.46,,United Kingdom
562417,23252,VINTAGE RED ENAMEL TRIM JUG,1,2011-08-04,7.46,,United Kingdom
562417,23297,SET 40 HEART SHAPE PETIT FOUR CASES,1,2011-08-04,3.29,,United Kingdom
562417,23309,SET OF 60 I LOVE LONDON CAKE CASES,1,2011-08-04,1.25,,United Kingdom
562417,23321,SMALL WHITE HEART OF WICKER,1,2011-08-04,3.29,,United Kingdom
562417,23341,PINK DINER WALL CLOCK,1,2011-08-04,16.63,,United Kingdom
562417,35916B,BLUE FELT HANGING HEART WITH FLOWER,1,2011-08-04,0.63,,United Kingdom
562417,35971,ROSE FOLKART HEART DECORATIONS,1,2011-08-04,2.46,,United Kingdom
562417,37447,CERAMIC CAKE DESIGN SPOTTED PLATE,1,2011-08-04,3.29,,United Kingdom
562417,37500,TEA TIME TEAPOT IN GIFT BOX,1,2011-08-04,8.29,,United Kingdom
562417,40016,CHINESE DRAGON PAPER LANTERNS,1,2011-08-04,8.29,,United Kingdom
562417,72799E,IVORY PILLAR CANDLE SILVER FLOCK,1,2011-08-04,3.29,,United Kingdom
562417,79190B,RETRO PLASTIC POLKA TRAY,1,2011-08-04,0.83,,United Kingdom
562417,82484,WOOD BLACK BOARD ANT WHITE FINISH,3,2011-08-04,16.63,,United Kingdom
562417,82567,"AIRLINE LOUNGE,METAL SIGN",1,2011-08-04,1.63,,United Kingdom
562417,84078A,SET/4 WHITE RETRO STORAGE CUBES,1,2011-08-04,58.29,,United Kingdom
562417,84251C,"GREETING CARD, TWO SISTERS.",1,2011-08-04,0.83,,United Kingdom
562417,84459A,PINK METAL CHICKEN HEART,1,2011-08-04,3.29,,United Kingdom
562417,84637,KITCHEN FLOWER POTS WALL PLAQUE,1,2011-08-04,4.96,,United Kingdom
562417,84796B,BLUE SAVANNAH PICNIC HAMPER FOR 2,1,2011-08-04,8.29,,United Kingdom
562417,84946,ANTIQUE SILVER T-LIGHT GLASS,44,2011-08-04,2.46,,United Kingdom
562417,84970L,SINGLE HEART ZINC T-LIGHT HOLDER,5,2011-08-04,2.08,,United Kingdom
562417,84970S,HANGING HEART ZINC T-LIGHT HOLDER,5,2011-08-04,2.08,,United Kingdom
562417,85099B,JUMBO BAG RED RETROSPOT,1,2011-08-04,4.13,,United Kingdom
562417,85099F,JUMBO BAG STRAWBERRY,1,2011-08-04,4.13,,United Kingdom
562417,85131B,BEADED CRYSTAL HEART GREEN ON STICK,1,2011-08-04,0.83,,United Kingdom
562417,85131D,BEADED CRYSTAL HEART PINK ON STICK,1,2011-08-04,0.83,,United Kingdom
562417,85132C,CHARLIE AND LOLA FIGURES TINS,1,2011-08-04,5.79,,United Kingdom
562417,90013A,MIDNIGHT BLUE VINTAGE EARRINGS,1,2011-08-04,3.73,,United Kingdom
562417,90013B,BLACK VINTAGE EARRINGS,1,2011-08-04,4.15,,United Kingdom
562417,90036E,"\"FLOWER GLASS GARLD NECKL36\"\"AMETHYST\"",1,2011-08-04,7.9,,United Kingdom
562417,DOT,DOTCOM POSTAGE,1,2011-08-04,141.5,,United Kingdom
562417,20719,WOODLAND CHARLOTTE BAG,2,2011-08-04,1.63,,United Kingdom
562417,20723,STRAWBERRY CHARLOTTE BAG,1,2011-08-04,1.63,,United Kingdom
562417,20725,LUNCH BAG RED RETROSPOT,1,2011-08-04,4.13,,United Kingdom
562417,20726,LUNCH BAG WOODLAND,2,2011-08-04,4.13,,United Kingdom
562417,20828,GLITTER BUTTERFLY CLIPS,1,2011-08-04,4.96,,United Kingdom
562417,21012,ANTIQUE ALL GLASS CANDLESTICK,16,2011-08-04,2.46,,United Kingdom
562417,21033,JUMBO BAG CHARLIE AND LOLA TOYS,14,2011-08-04,2.46,,United Kingdom
562417,21055,TOOL BOX SOFT TOY,1,2011-08-04,16.63,,United Kingdom
562417,21080,SET/20 RED RETROSPOT PAPER NAPKINS,5,2011-08-04,1.63,,United Kingdom
562417,21086,SET/6 RED SPOTTY PAPER CUPS,10,2011-08-04,1.63,,United Kingdom
562417,21094,SET/6 RED SPOTTY PAPER PLATES,18,2011-08-04,0.83,,United Kingdom
562417,21175,GIN + TONIC DIET METAL SIGN,1,2011-08-04,4.96,,United Kingdom
562417,21179,NO JUNK MAIL METAL SIGN,1,2011-08-04,1.63,,United Kingdom
562417,21187,WHITE BELL HONEYCOMB PAPER GARLAND,2,2011-08-04,3.29,,United Kingdom
562417,21189,WHITE HONEYCOMB PAPER GARLAND,2,2011-08-04,3.29,,United Kingdom
562417,21213,PACK OF 72 SKULL CAKE CASES,1,2011-08-04,1.25,,United Kingdom
562417,21231,SWEETHEART CERAMIC TRINKET BOX,1,2011-08-04,2.46,,United Kingdom
562417,21232,STRAWBERRY CERAMIC TRINKET BOX,1,2011-08-04,2.46,,United Kingdom
562417,21240,BLUE POLKADOT CUP,2,2011-08-04,1.63,,United Kingdom
562417,21326,AGED GLASS SILVER T-LIGHT HOLDER,11,2011-08-04,1.63,,United Kingdom
562417,21519,GIN & TONIC DIET GREETING CARD,2,2011-08-04,0.83,,United Kingdom
562417,21715,GIRLS VINTAGE TIN SEASIDE BUCKET,1,2011-08-04,4.96,,United Kingdom
562417,21718,RED METAL BEACH SPADE,1,2011-08-04,2.46,,United Kingdom
562417,21733,RED HANGING HEART T-LIGHT HOLDER,1,2011-08-04,5.79,,United Kingdom
562417,21746,SMALL RED RETROSPOT WINDMILL,2,2011-08-04,2.46,,United Kingdom
562417,21747,SMALL SKULL WINDMILL,2,2011-08-04,2.46,,United Kingdom
562417,21749,LARGE RED RETROSPOT WINDMILL,1,2011-08-04,4.13,,United Kingdom
562417,21750,LARGE SKULL WINDMILL,1,2011-08-04,4.13,,United Kingdom
562417,21754,HOME BUILDING BLOCK WORD,1,2011-08-04,11.63,,United Kingdom
562417,21755,LOVE BUILDING BLOCK WORD,1,2011-08-04,12.46,,United Kingdom
562417,21758,VINTAGE SHELLS PRINT,1,2011-08-04,12.46,,United Kingdom
562417,21811,HANGING HEART WITH BELL,1,2011-08-04,2.46,,United Kingdom
562417,21899,GARAGE KEY FOB,2,2011-08-04,1.63,,United Kingdom
562417,21900,"KEY FOB , SHED",1,2011-08-04,1.63,,United Kingdom
562417,21901,"KEY FOB , BACK DOOR",1,2011-08-04,1.63,,United Kingdom
562417,21902,"KEY FOB , FRONT  DOOR",1,2011-08-04,1.63,,United Kingdom
562417,21916,SET 12 RETRO WHITE CHALK STICKS,2,2011-08-04,0.83,,United Kingdom
562417,21917,SET 12 KIDS  WHITE CHALK STICKS,1,2011-08-04,0.83,,United Kingdom
562417,21918,SET 12 KIDS COLOUR  CHALK STICKS,1,2011-08-04,0.83,,United Kingdom
562417,21928,JUMBO BAG SCANDINAVIAN BLUE PAISLEY,1,2011-08-04,4.13,,United Kingdom
562417,21931,JUMBO STORAGE BAG SUKI,2,2011-08-04,4.13,,United Kingdom
562417,21932,SCANDINAVIAN PAISLEY PICNIC BAG,1,2011-08-04,2.46,,United Kingdom
562417,21933,PINK VINTAGE PAISLEY PICNIC BAG,1,2011-08-04,2.46,,United Kingdom
562417,21936,RED RETROSPOT PICNIC BAG,1,2011-08-04,5.79,,United Kingdom
562417,82482,WOODEN PICTURE FRAME WHITE FINISH,11,2011-08-04,2.55,,United Kingdom
562417,82494L,WOODEN FRAME ANTIQUE WHITE,9,2011-08-04,2.95,,United Kingdom
562417,84879,ASSORTED COLOUR BIRD ORNAMENT,16,2011-08-04,1.69,,United Kingdom
562418,23243,SET OF TEA COFFEE SUGAR TINS PANTRY,4,2011-08-04,4.95,16572,United Kingdom
562418,22652,TRAVEL SEWING KIT,20,2011-08-04,1.65,16572,United Kingdom
562418,22558,CLOTHES PEGS RETROSPOT PACK 24,12,2011-08-04,1.65,16572,United Kingdom
562418,23168,CLASSIC CAFE SUGAR DISPENSER,12,2011-08-04,1.25,16572,United Kingdom
562418,22966,GINGERBREAD MAN COOKIE CUTTER,12,2011-08-04,1.25,16572,United Kingdom
562418,22907,PACK OF 20 NAPKINS PANTRY DESIGN,12,2011-08-04,0.85,16572,United Kingdom
562418,22993,SET OF 4 PANTRY JELLY MOULDS,24,2011-08-04,1.25,16572,United Kingdom
562418,23245,SET OF 3 REGENCY CAKE TINS,4,2011-08-04,4.95,16572,United Kingdom
562418,22423,REGENCY CAKESTAND 3 TIER,1,2011-08-04,12.75,16572,United Kingdom
562418,48187,DOORMAT NEW ENGLAND,2,2011-08-04,7.95,16572,United Kingdom
562418,48184,DOORMAT ENGLISH ROSE,2,2011-08-04,7.95,16572,United Kingdom
562418,48188,DOORMAT WELCOME PUPPIES,2,2011-08-04,7.95,16572,United Kingdom
562418,22824,3 TIER SWEETHEART GARDEN SHELF,1,2011-08-04,35.95,16572,United Kingdom
562418,71477,COLOUR GLASS. STAR T-LIGHT HOLDER,8,2011-08-04,3.25,16572,United Kingdom
562418,22077,6 RIBBONS RUSTIC CHARM,12,2011-08-04,1.65,16572,United Kingdom
562418,23235,STORAGE TIN VINTAGE LEAF,6,2011-08-04,2.89,16572,United Kingdom
562418,22090,PAPER BUNTING RETROSPOT,6,2011-08-04,2.95,16572,United Kingdom
562418,22979,PANTRY WASHING UP BRUSH,12,2011-08-04,1.45,16572,United Kingdom
562418,22151,PLACE SETTING WHITE HEART,24,2011-08-04,0.42,16572,United Kingdom
562419,20764,ABSTRACT CIRCLES SKETCHBOOK,1,2011-08-04,3.75,14667,United Kingdom
562419,20754,RETROSPOT RED WASHING UP GLOVES,5,2011-08-04,2.1,14667,United Kingdom
562419,22097,SWALLOW SQUARE TISSUE BOX,1,2011-08-04,0.39,14667,United Kingdom
562419,22094,RED RETROSPOT TISSUE BOX,1,2011-08-04,0.39,14667,United Kingdom
562419,21735,TWO DOOR CURIO CABINET,2,2011-08-04,12.75,14667,United Kingdom
562419,21033,JUMBO BAG CHARLIE AND LOLA TOYS,10,2011-08-04,2.08,14667,United Kingdom
562419,23202,JUMBO BAG VINTAGE LEAF,10,2011-08-04,2.08,14667,United Kingdom
562419,85099B,JUMBO BAG RED RETROSPOT,50,2011-08-04,2.08,14667,United Kingdom
562419,22384,LUNCH BAG PINK POLKADOT,1,2011-08-04,1.65,14667,United Kingdom
562419,20728,LUNCH BAG CARS BLUE,9,2011-08-04,1.65,14667,United Kingdom
562419,22382,LUNCH BAG SPACEBOY DESIGN,10,2011-08-04,1.65,14667,United Kingdom
562419,23076,ICE CREAM SUNDAE LIP GLOSS,24,2011-08-04,1.25,14667,United Kingdom
562420,21454,PAINTED PINK RABBIT,2,2011-08-04,0.83,,United Kingdom
562420,21471,STRAWBERRY RAFFIA FOOD COVER,1,2011-08-04,3.29,,United Kingdom
562420,21754,HOME BUILDING BLOCK WORD,1,2011-08-04,11.63,,United Kingdom
562420,21829,DINOSAUR KEYRINGS ASSORTED,1,2011-08-04,0.42,,United Kingdom
562420,21878,PACK OF 6 SANDCASTLE FLAGS ASSORTED,1,2011-08-04,1.63,,United Kingdom
562420,21905,MORE BUTTER METAL SIGN,1,2011-08-04,1.63,,United Kingdom
562420,21906,PHARMACIE FIRST AID TIN,1,2011-08-04,13.29,,United Kingdom
562420,21912,VINTAGE SNAKES & LADDERS,1,2011-08-04,7.46,,United Kingdom
562420,21913,VINTAGE SEASIDE JIGSAW PUZZLES,1,2011-08-04,7.46,,United Kingdom
562420,21928,JUMBO BAG SCANDINAVIAN BLUE PAISLEY,1,2011-08-04,4.13,,United Kingdom
562420,21932,SCANDINAVIAN PAISLEY PICNIC BAG,9,2011-08-04,2.46,,United Kingdom
562420,21933,PINK VINTAGE PAISLEY PICNIC BAG,9,2011-08-04,2.46,,United Kingdom
562420,21935,SUKI  SHOULDER BAG,1,2011-08-04,3.29,,United Kingdom
562420,21967,PACK OF 12 SKULL TISSUES,1,2011-08-04,0.83,,United Kingdom
562420,21975,PACK OF 60 DINOSAUR CAKE CASES,1,2011-08-04,1.25,,United Kingdom
562420,21980,PACK OF 12 RED RETROSPOT TISSUES,1,2011-08-04,0.83,,United Kingdom
562420,21982,PACK OF 12 SUKI TISSUES,1,2011-08-04,0.83,,United Kingdom
562420,21985,PACK OF 12 HEARTS DESIGN TISSUES,1,2011-08-04,0.83,,United Kingdom
562420,21990,MODERN FLORAL STATIONERY SET,1,2011-08-04,2.46,,United Kingdom
562420,21993,FLORAL FOLK STATIONERY SET,2,2011-08-04,2.46,,United Kingdom
562420,22077,6 RIBBONS RUSTIC CHARM,1,2011-08-04,3.29,,United Kingdom
562420,22096,PINK PAISLEY SQUARE TISSUE BOX,1,2011-08-04,2.46,,United Kingdom
562420,22101,MIRROR MOSAIC VOTIVE HOLDER,20,2011-08-04,2.46,,United Kingdom
562420,22124,SET OF 2 TEA TOWELS PING MICROWAVE,1,2011-08-04,2.46,,United Kingdom
562420,22135,MINI LADLE LOVE HEART PINK,1,2011-08-04,0.83,,United Kingdom
562420,22165,"DIAMANTE HEART SHAPED WALL MIRROR,",1,2011-08-04,10.79,,United Kingdom
562420,22167,OVAL WALL MIRROR DIAMANTE,1,2011-08-04,8.29,,United Kingdom
562420,22171,3 HOOK PHOTO SHELF ANTIQUE WHITE,1,2011-08-04,16.63,,United Kingdom
562420,22173,METAL 4 HOOK HANGER FRENCH CHATEAU,2,2011-08-04,5.79,,United Kingdom
562420,22178,VICTORIAN GLASS HANGING T-LIGHT,3,2011-08-04,2.46,,United Kingdom
562420,22185,SLATE TILE NATURAL HANGING,1,2011-08-04,3.29,,United Kingdom
562420,22197,POPCORN HOLDER,6,2011-08-04,1.63,,United Kingdom
562420,22268,DECORATION SITTING BUNNY,2,2011-08-04,0.63,,United Kingdom
562420,22269,EGG CUP NATURAL CHICKEN,12,2011-08-04,0.83,,United Kingdom
562420,22278,OVERNIGHT BAG VINTAGE ROSE PAISLEY,1,2011-08-04,10.79,,United Kingdom
562420,22305,COFFEE MUG PINK PAISLEY DESIGN,1,2011-08-04,4.96,,United Kingdom
562420,22332,SKULLS PARTY BAG + STICKER SET,1,2011-08-04,3.29,,United Kingdom
562420,22381,TOY TIDY PINK POLKADOT,1,2011-08-04,4.13,,United Kingdom
562420,22383,LUNCH BAG SUKI DESIGN,1,2011-08-04,4.13,,United Kingdom
562420,22403,MAGNETS PACK OF 4 VINTAGE LABELS,1,2011-08-04,2.46,,United Kingdom
562420,22413,METAL SIGN TAKE IT OR LEAVE IT,1,2011-08-04,5.79,,United Kingdom
562420,22419,LIPSTICK PEN RED,50,2011-08-04,0.83,,United Kingdom
562420,22420,LIPSTICK PEN BABY PINK,50,2011-08-04,0.83,,United Kingdom
562420,22421,LIPSTICK PEN FUSCHIA,50,2011-08-04,0.83,,United Kingdom
562420,22423,REGENCY CAKESTAND 3 TIER,1,2011-08-04,24.96,,United Kingdom
562420,22457,NATURAL SLATE HEART CHALKBOARD,2,2011-08-04,5.79,,United Kingdom
562420,22467,GUMBALL COAT RACK,1,2011-08-04,4.96,,United Kingdom
562420,22469,HEART OF WICKER SMALL,1,2011-08-04,3.29,,United Kingdom
562420,22473,TV DINNER TRAY VINTAGE PAISLEY,1,2011-08-04,10.79,,United Kingdom
562420,22487,WHITE WOOD GARDEN PLANT LADDER,1,2011-08-04,19.96,,United Kingdom
562420,22492,MINI PAINT SET VINTAGE,3,2011-08-04,1.63,,United Kingdom
562420,22494,EMERGENCY FIRST AID TIN,1,2011-08-04,2.46,,United Kingdom
562420,22495,SET OF 2 ROUND TINS CAMEMBERT,1,2011-08-04,5.79,,United Kingdom
562420,22500,SET OF 2 TINS JARDIN DE PROVENCE,1,2011-08-04,10.79,,United Kingdom
562420,22501,PICNIC BASKET WICKER LARGE,1,2011-08-04,20.79,,United Kingdom
562420,22534,MAGIC DRAWING SLATE SPACEBOY,3,2011-08-04,0.83,,United Kingdom
562420,22567,20 DOLLY PEGS RETROSPOT,1,2011-08-04,2.92,,United Kingdom
562420,22614,PACK OF 12 SPACEBOY TISSUES,1,2011-08-04,0.83,,United Kingdom
562420,22615,PACK OF 12 CIRCUS PARADE TISSUES,1,2011-08-04,0.83,,United Kingdom
562420,22616,PACK OF 12 LONDON TISSUES,1,2011-08-04,0.83,,United Kingdom
562420,22620,4 TRADITIONAL SPINNING TOPS,1,2011-08-04,2.46,,United Kingdom
562420,22659,LUNCH BOX I LOVE LONDON,1,2011-08-04,4.13,,United Kingdom
562420,22665,RECIPE BOX BLUE SKETCHBOOK DESIGN,1,2011-08-04,5.79,,United Kingdom
562420,22666,RECIPE BOX PANTRY YELLOW DESIGN,1,2011-08-04,5.79,,United Kingdom
562420,22671,FRENCH LAUNDRY SIGN BLUE METAL,1,2011-08-04,3.29,,United Kingdom
562420,22697,GREEN REGENCY TEACUP AND SAUCER,3,2011-08-04,5.79,,United Kingdom
562420,22698,PINK REGENCY TEACUP AND SAUCER,2,2011-08-04,5.79,,United Kingdom
562420,22720,SET OF 3 CAKE TINS PANTRY DESIGN,2,2011-08-04,10.79,,United Kingdom
562420,22730,ALARM CLOCK BAKELIKE IVORY,1,2011-08-04,7.46,,United Kingdom
562420,22734,SET OF 6 RIBBONS VINTAGE CHRISTMAS,1,2011-08-04,5.79,,United Kingdom
562420,22748,POPPY'S PLAYHOUSE KITCHEN,1,2011-08-04,4.13,,United Kingdom
562420,22762,CUPBOARD 3 DRAWER MA CAMPAGNE,1,2011-08-04,29.17,,United Kingdom
562420,22841,ROUND CAKE TIN VINTAGE GREEN,1,2011-08-04,15.79,,United Kingdom
562420,22948,METAL DECORATION NAUGHTY CHILDREN,4,2011-08-04,1.66,,United Kingdom
562420,22965,3 TRADITIONAl BISCUIT CUTTERS  SET,1,2011-08-04,4.13,,United Kingdom
562420,22966,GINGERBREAD MAN COOKIE CUTTER,1,2011-08-04,2.46,,United Kingdom
562420,22971,QUEENS GUARD COFFEE MUG,1,2011-08-04,4.96,,United Kingdom
562420,22973,CHILDREN'S CIRCUS PARADE MUG,1,2011-08-04,3.29,,United Kingdom
562420,22983,CARD BILLBOARD FONT,1,2011-08-04,0.83,,United Kingdom
562420,22992,REVOLVER WOODEN RULER,1,2011-08-04,4.13,,United Kingdom
562420,23029,DRAWER KNOB CRACKLE GLAZE GREEN,6,2011-08-04,3.29,,United Kingdom
562420,23050,RECYCLED ACAPULCO MAT GREEN,1,2011-08-04,16.63,,United Kingdom
562420,23051,RECYCLED ACAPULCO MAT BLUE,1,2011-08-04,16.63,,United Kingdom
562420,23084,RABBIT NIGHT LIGHT,3,2011-08-04,4.13,,United Kingdom
562420,23124,18PC WOODEN CUTLERY SET DISPOSABLE,1,2011-08-04,2.46,,United Kingdom
562420,23125,6PC WOOD PLATE SET DISPOSABLE,1,2011-08-04,2.46,,United Kingdom
562420,23166,MEDIUM CERAMIC TOP STORAGE JAR,8,2011-08-04,2.46,,United Kingdom
562420,23171,REGENCY TEA PLATE GREEN,1,2011-08-04,3.29,,United Kingdom
562420,23179,CLOCK MAGNET MUM'S KITCHEN,1,2011-08-04,5.79,,United Kingdom
562420,23182,TOILET SIGN OCCUPIED OR VACANT,2,2011-08-04,2.46,,United Kingdom
562420,23196,VINTAGE LEAF MAGNETIC NOTEPAD,1,2011-08-04,3.29,,United Kingdom
562420,23199,JUMBO BAG APPLES,1,2011-08-04,4.13,,United Kingdom
562420,23200,JUMBO BAG PEARS,1,2011-08-04,4.13,,United Kingdom
562420,23202,JUMBO BAG VINTAGE LEAF,1,2011-08-04,4.13,,United Kingdom
562420,23203,JUMBO BAG VINTAGE DOILEY,1,2011-08-04,4.13,,United Kingdom
562420,23205,CHARLOTTE BAG VINTAGE ALPHABET,1,2011-08-04,1.63,,United Kingdom
562420,23209,LUNCH BAG VINTAGE DOILEY,1,2011-08-04,4.13,,United Kingdom
562420,23245,SET OF 3 REGENCY CAKE TINS,1,2011-08-04,10.79,,United Kingdom
562420,23289,DOLLY GIRL CHILDRENS BOWL,1,2011-08-04,2.46,,United Kingdom
562420,23290,SPACEBOY CHILDRENS BOWL,1,2011-08-04,2.46,,United Kingdom
562420,23291,DOLLY GIRL CHILDRENS CUP,1,2011-08-04,2.46,,United Kingdom
562420,23292,SPACEBOY CHILDRENS CUP,1,2011-08-04,2.46,,United Kingdom
562420,23293,SET OF 12 FAIRY CAKE BAKING CASES,1,2011-08-04,2.46,,United Kingdom
562420,23294,SET OF 6 SNACK LOAF BAKING CASES,1,2011-08-04,2.46,,United Kingdom
562420,23296,SET OF 6 TEA TIME BAKING CASES,1,2011-08-04,3.29,,United Kingdom
562420,23297,SET 40 HEART SHAPE PETIT FOUR CASES,1,2011-08-04,3.29,,United Kingdom
562420,23298,SPOTTY BUNTING,1,2011-08-04,10.79,,United Kingdom
562420,23301,GARDENERS KNEELING PAD KEEP CALM,1,2011-08-04,3.29,,United Kingdom
562420,23302,KNEELING MAT HOUSEWORK  DESIGN,1,2011-08-04,3.29,,United Kingdom
562420,23307,SET OF 60 PANTRY DESIGN CAKE CASES,2,2011-08-04,1.25,,United Kingdom
562420,23309,SET OF 60 I LOVE LONDON CAKE CASES,2,2011-08-04,1.25,,United Kingdom
562420,23321,SMALL WHITE HEART OF WICKER,16,2011-08-04,3.29,,United Kingdom
562420,37327,ASSTD MULTICOLOUR CIRCLES MUG,6,2011-08-04,0.97,,United Kingdom
562420,40016,CHINESE DRAGON PAPER LANTERNS,1,2011-08-04,8.29,,United Kingdom
562420,47367B,PAIR PADDED HANGERS PINK CHECK,2,2011-08-04,3.29,,United Kingdom
562420,47593B,SCOTTIE DOGS BABY BIB,1,2011-08-04,0.83,,United Kingdom
562420,48111,DOORMAT 3 SMILEY CATS,1,2011-08-04,15.79,,United Kingdom
562420,48194,DOORMAT HEARTS,1,2011-08-04,15.79,,United Kingdom
562420,72741,GRAND CHOCOLATECANDLE,3,2011-08-04,2.76,,United Kingdom
562420,79144B,PAINTED LIGHTBULB STAR+ MOON,1,2011-08-04,0.83,,United Kingdom
562420,79144C,PAINTED LIGHTBULB RAINBOW DESIGN,1,2011-08-04,0.83,,United Kingdom
562420,79190A,RETRO PLASTIC 70'S TRAY,1,2011-08-04,0.83,,United Kingdom
562420,82482,WOODEN PICTURE FRAME WHITE FINISH,5,2011-08-04,2.55,,United Kingdom
562420,82483,WOOD 2 DRAWER CABINET WHITE FINISH,3,2011-08-04,7.46,,United Kingdom
562420,82484,WOOD BLACK BOARD ANT WHITE FINISH,1,2011-08-04,16.63,,United Kingdom
562420,82613C,"METAL SIGN,CUPCAKE SINGLE HOOK",1,2011-08-04,2.46,,United Kingdom
562420,82613D,METAL SIGN CUPCAKE SINGLE HOOK,1,2011-08-04,2.46,,United Kingdom
562420,84077,WORLD WAR 2 GLIDERS ASSTD DESIGNS,2,2011-08-04,0.63,,United Kingdom
562420,84078A,SET/4 WHITE RETRO STORAGE CUBES,2,2011-08-04,58.29,,United Kingdom
562420,84406B,CREAM CUPID HEARTS COAT HANGER,1,2011-08-04,8.29,,United Kingdom
562420,84507B,STRIPES DESIGN MONKEY DOLL,1,2011-08-04,4.96,,United Kingdom
562420,84659A,WHITE TRAVEL ALARM CLOCK,2,2011-08-04,2.46,,United Kingdom
562420,84755,COLOUR GLASS T-LIGHT HOLDER HANGING,4,2011-08-04,1.24,,United Kingdom
562420,84796B,BLUE SAVANNAH PICNIC HAMPER FOR 2,1,2011-08-04,8.29,,United Kingdom
562420,84946,ANTIQUE SILVER T-LIGHT GLASS,21,2011-08-04,2.46,,United Kingdom
562420,84968C,SET OF 16 VINTAGE PISTACHIO CUTLERY,1,2011-08-04,24.96,,United Kingdom
562420,85017B,ENVELOPE 50 BLOSSOM IMAGES,1,2011-08-04,0.83,,United Kingdom
562420,85054,FRENCH ENAMEL POT W LID,1,2011-08-04,5.79,,United Kingdom
562420,85093,CANDY SPOT EGG WARMER HARE,4,2011-08-04,0.83,,United Kingdom
562420,85099B,JUMBO BAG RED RETROSPOT,2,2011-08-04,4.13,,United Kingdom
562420,85099F,JUMBO BAG STRAWBERRY,1,2011-08-04,4.13,,United Kingdom
562420,85123A,WHITE HANGING HEART T-LIGHT HOLDER,3,2011-08-04,5.79,,United Kingdom
562420,85131B,BEADED CRYSTAL HEART GREEN ON STICK,1,2011-08-04,0.83,,United Kingdom
562420,85131D,BEADED CRYSTAL HEART PINK ON STICK,1,2011-08-04,0.83,,United Kingdom
562420,85132C,CHARLIE AND LOLA FIGURES TINS,2,2011-08-04,5.79,,United Kingdom
562420,85152,HAND OVER THE CHOCOLATE   SIGN,1,2011-08-04,4.13,,United Kingdom
562420,90037B,TINY CRYSTAL BRACELET GREEN,1,2011-08-04,2.48,,United Kingdom
562420,90214B,"\"LETTER \"\"B\"\" BLING KEY RING\"",1,2011-08-04,0.83,,United Kingdom
562420,90214H,"\"LETTER \"\"H\"\" BLING KEY RING\"",1,2011-08-04,0.83,,United Kingdom
562420,90214J,"\"LETTER \"\"J\"\" BLING KEY RING\"",1,2011-08-04,0.83,,United Kingdom
562420,90214L,"\"LETTER \"\"L\"\" BLING KEY RING\"",2,2011-08-04,0.83,,United Kingdom
562420,90214T,"\"LETTER \"\"T\"\" BLING KEY RING\"",1,2011-08-04,0.83,,United Kingdom
562420,90214V,"\"LETTER \"\"V\"\" BLING KEY RING\"",1,2011-08-04,0.83,,United Kingdom
562420,gift_0001_20,Dotcomgiftshop Gift Voucher 20.00,1,2011-08-04,16.67,,United Kingdom
562420,DOT,DOTCOM POSTAGE,1,2011-08-04,170.98,,United Kingdom
562420,10133,COLOURING PENCILS BROWN TUBE,1,2011-08-04,0.83,,United Kingdom
562420,15036,ASSORTED COLOURS SILK FAN,6,2011-08-04,1.63,,United Kingdom
562420,15039,SANDALWOOD FAN,2,2011-08-04,1.63,,United Kingdom
562420,15058B,PINK POLKADOT GARDEN PARASOL,1,2011-08-04,10.79,,United Kingdom
562420,20685,DOORMAT RED RETROSPOT,1,2011-08-04,15.79,,United Kingdom
562420,20712,JUMBO BAG WOODLAND ANIMALS,1,2011-08-04,4.13,,United Kingdom
562420,20724,RED RETROSPOT CHARLOTTE BAG,1,2011-08-04,1.63,,United Kingdom
562420,20726,LUNCH BAG WOODLAND,1,2011-08-04,4.13,,United Kingdom
562420,20903,VINTAGE KEEPSAKE BOX TRAVELOGUE,2,2011-08-04,4.13,,United Kingdom
562420,20914,SET/5 RED RETROSPOT LID GLASS BOWLS,1,2011-08-04,5.79,,United Kingdom
562420,21033,JUMBO BAG CHARLIE AND LOLA TOYS,11,2011-08-04,2.46,,United Kingdom
562420,21080,SET/20 RED RETROSPOT PAPER NAPKINS,4,2011-08-04,1.63,,United Kingdom
562420,21084,SET/6 COLLAGE PAPER CUPS,12,2011-08-04,0.83,,United Kingdom
562420,21090,SET/6 COLLAGE PAPER PLATES,12,2011-08-04,0.83,,United Kingdom
562420,21155,RED RETROSPOT PEG BAG,1,2011-08-04,4.96,,United Kingdom
562420,21174,POTTERING IN THE SHED METAL SIGN,1,2011-08-04,4.13,,United Kingdom
562420,21179,NO JUNK MAIL METAL SIGN,1,2011-08-04,1.63,,United Kingdom
562420,84879,ASSORTED COLOUR BIRD ORNAMENT,8,2011-08-04,1.69,,United Kingdom
562420,82494L,WOODEN FRAME ANTIQUE WHITE,5,2011-08-04,2.95,,United Kingdom
562421,21402,RED  EGG  SPOON,24,2011-08-04,0.12,15241,United Kingdom
562421,21400,RED PUDDING SPOON,24,2011-08-04,0.12,15241,United Kingdom
562421,47518F,ICON PLACEMAT POP ART ELVIS,48,2011-08-04,0.12,15241,United Kingdom
562421,22348,TEA BAG PLATE RED RETROSPOT,12,2011-08-04,0.85,15241,United Kingdom
562421,21394,RED POLKADOT BEAKER,48,2011-08-04,0.39,15241,United Kingdom
562421,21401,BLUE PUDDING SPOON,24,2011-08-04,0.12,15241,United Kingdom
562421,21403,BLUE EGG  SPOON,24,2011-08-04,0.12,15241,United Kingdom
562421,22115,METAL SIGN EMPIRE TEA,12,2011-08-04,0.79,15241,United Kingdom
562421,21395,BLUE POLKADOT BEAKER,48,2011-08-04,0.39,15241,United Kingdom
562422,84569D,PACK 6 HEART/ICE-CREAM PATCHES,12,2011-08-04,1.25,13218,United Kingdom
562422,21439,BASKET OF TOADSTOOLS,12,2011-08-04,1.25,13218,United Kingdom
562422,85040A,S/4 PINK FLOWER CANDLES IN BOWL,12,2011-08-04,1.65,13218,United Kingdom
562422,21981,PACK OF 12 WOODLAND TISSUES,24,2011-08-04,0.29,13218,United Kingdom
562422,16238,PARTY TIME PENCIL ERASERS,28,2011-08-04,0.21,13218,United Kingdom
C562423,22720,SET OF 3 CAKE TINS PANTRY DESIGN,-2,2011-08-04,4.95,12584,Italy
C562423,22627,MINT KITCHEN SCALES,-2,2011-08-04,8.5,12584,Italy
C562423,22423,REGENCY CAKESTAND 3 TIER,-1,2011-08-04,12.75,12584,Italy
562424,22423,REGENCY CAKESTAND 3 TIER,1,2011-08-04,12.75,12584,Italy
